{
  "schema": "teistro-conformance/baseline-dasha-systems/1",
  "fixture": "variants/c052-kathmandu-2020-04-13--geocentric.json",
  "provenance": {
    "source": "baseline-engine",
    "evidence_rank": 2,
    "engine_version": "1.8.0",
    "exporter_version": "1.0.0",
    "inputs": "the fixture's recorded dashas.moon_sidereal_longitude_deg, input.resolved.jd_ut and, per method, dashas.methods.*.nakshatra_span"
  },
  "year_length_days": 365.25,
  "reference_instants_jd": [2468953.122303241, 2461287.5],
  "systems": {
    "ashtottari": {
      "total_years": 108,
      "sequence": [
        {
          "lord": "SUN",
          "years": 6
        },
        {
          "lord": "MOON",
          "years": 15
        },
        {
          "lord": "MARS",
          "years": 8
        },
        {
          "lord": "MERCURY",
          "years": 17
        },
        {
          "lord": "SATURN",
          "years": 10
        },
        {
          "lord": "JUPITER",
          "years": 19
        },
        {
          "lord": "RAHU",
          "years": 12
        },
        {
          "lord": "VENUS",
          "years": 21
        }
      ],
      "reference_nakshatra": 5,
      "count": "from_reference",
      "span": 3,
      "offset": 0,
      "methods": {
        "spatial": {
          "first_lord": "SATURN",
          "balance": {
            "years": 3,
            "months": 1,
            "days": 21,
            "hours": 4,
            "minutes": 9,
            "total_days": 1147.3606573634947
          },
          "tree_depth": 2,
          "row_format": ["path", "lord", "start_jd", "end_jd"],
          "periods": [
            ["0", "SATURN", 2458953.122303241, 2460100.4829606046],
            ["0/0", "SATURN", 2458953.122303241, 2459059.359401145],
            ["0/1", "JUPITER", 2459059.359401145, 2459261.209887163],
            ["0/2", "RAHU", 2459261.209887163, 2459388.6944046477],
            ["0/3", "VENUS", 2459388.6944046477, 2459611.792310246],
            ["0/4", "SUN", 2459611.792310246, 2459675.5345689883],
            ["0/5", "MOON", 2459675.5345689883, 2459834.8902158444],
            ["0/6", "MARS", 2459834.8902158444, 2459919.8798941677],
            ["0/7", "MERCURY", 2459919.8798941677, 2460100.4829606046],
            ["1", "JUPITER", 2460100.4829606046, 2467040.2329606046],
            ["1/0", "JUPITER", 2460100.4829606046, 2461321.364905049],
            ["1/1", "RAHU", 2461321.364905049, 2462092.4482383826],
            ["1/2", "VENUS", 2462092.4482383826, 2463441.8440717156],
            ["1/3", "SUN", 2463441.8440717156, 2463827.3857383826],
            ["1/4", "MOON", 2463827.3857383826, 2464791.239905049],
            ["1/5", "MARS", 2464791.239905049, 2465305.2954606046],
            ["1/6", "MERCURY", 2465305.2954606046, 2466397.66351616],
            ["1/7", "SATURN", 2466397.66351616, 2467040.2329606046],
            ["2", "RAHU", 2467040.2329606046, 2471423.2329606046],
            ["2/0", "RAHU", 2467040.2329606046, 2467527.2329606046],
            ["2/1", "VENUS", 2467527.2329606046, 2468379.4829606046],
            ["2/2", "SUN", 2468379.4829606046, 2468622.9829606046],
            ["2/3", "MOON", 2468622.9829606046, 2469231.7329606046],
            ["2/4", "MARS", 2469231.7329606046, 2469556.399627271],
            ["2/5", "MERCURY", 2469556.399627271, 2470246.316293938],
            ["2/6", "SATURN", 2470246.316293938, 2470652.149627271],
            ["2/7", "JUPITER", 2470652.149627271, 2471423.2329606046],
            ["3", "VENUS", 2471423.2329606046, 2479093.4829606046],
            ["3/0", "VENUS", 2471423.2329606046, 2472914.6704606046],
            ["3/1", "SUN", 2472914.6704606046, 2473340.7954606046],
            ["3/2", "MOON", 2473340.7954606046, 2474406.1079606046],
            ["3/3", "MARS", 2474406.1079606046, 2474974.274627271],
            ["3/4", "MERCURY", 2474974.274627271, 2476181.628793938],
            ["3/5", "SATURN", 2476181.628793938, 2476891.837127271],
            ["3/6", "JUPITER", 2476891.837127271, 2478241.2329606046],
            ["3/7", "RAHU", 2478241.2329606046, 2479093.4829606046],
            ["4", "SUN", 2479093.4829606046, 2481284.9829606046],
            ["4/0", "SUN", 2479093.4829606046, 2479215.2329606046],
            ["4/1", "MOON", 2479215.2329606046, 2479519.6079606046],
            ["4/2", "MARS", 2479519.6079606046, 2479681.941293938],
            ["4/3", "MERCURY", 2479681.941293938, 2480026.899627271],
            ["4/4", "SATURN", 2480026.899627271, 2480229.816293938],
            ["4/5", "JUPITER", 2480229.816293938, 2480615.3579606046],
            ["4/6", "RAHU", 2480615.3579606046, 2480858.8579606046],
            ["4/7", "VENUS", 2480858.8579606046, 2481284.9829606046],
            ["5", "MOON", 2481284.9829606046, 2486763.7329606046],
            ["5/0", "MOON", 2481284.9829606046, 2482045.9204606046],
            ["5/1", "MARS", 2482045.9204606046, 2482451.753793938],
            ["5/2", "MERCURY", 2482451.753793938, 2483314.149627271],
            ["5/3", "SATURN", 2483314.149627271, 2483821.441293938],
            ["5/4", "JUPITER", 2483821.441293938, 2484785.2954606046],
            ["5/5", "RAHU", 2484785.2954606046, 2485394.0454606046],
            ["5/6", "VENUS", 2485394.0454606046, 2486459.3579606046],
            ["5/7", "SUN", 2486459.3579606046, 2486763.7329606046],
            ["6", "MARS", 2486763.7329606046, 2489685.7329606046],
            ["6/0", "MARS", 2486763.7329606046, 2486980.177405049],
            ["6/1", "MERCURY", 2486980.177405049, 2487440.1218494936],
            ["6/2", "SATURN", 2487440.1218494936, 2487710.677405049],
            ["6/3", "JUPITER", 2487710.677405049, 2488224.7329606046],
            ["6/4", "RAHU", 2488224.7329606046, 2488549.399627271],
            ["6/5", "VENUS", 2488549.399627271, 2489117.566293938],
            ["6/6", "SUN", 2489117.566293938, 2489279.899627271],
            ["6/7", "MOON", 2489279.899627271, 2489685.7329606046],
            ["7", "MERCURY", 2489685.7329606046, 2495894.9829606046],
            ["7/0", "MERCURY", 2489685.7329606046, 2490663.114905049],
            ["7/1", "SATURN", 2490663.114905049, 2491238.0454606046],
            ["7/2", "JUPITER", 2491238.0454606046, 2492330.41351616],
            ["7/3", "RAHU", 2492330.41351616, 2493020.3301828266],
            ["7/4", "VENUS", 2493020.3301828266, 2494227.6843494936],
            ["7/5", "SUN", 2494227.6843494936, 2494572.6426828266],
            ["7/6", "MOON", 2494572.6426828266, 2495435.03851616],
            ["7/7", "MARS", 2495435.03851616, 2495894.9829606046]
          ],
          "chain_depth": 4,
          "chain_format": ["level", "index", "lord", "start_jd", "end_jd"],
          "active_at": [
            {
              "jd": 2468953.122303241,
              "chain": [
                [1, 2, "RAHU", 2467040.2329606046, 2471423.2329606046],
                [2, 3, "MOON", 2468622.9829606046, 2469231.7329606046],
                [3, 4, "JUPITER", 2468904.8116643084, 2469011.9065717156],
                [4, 2, "VENUS", 2468935.551869212, 2468956.375878986]
              ]
            },
            {
              "jd": 2461287.5,
              "chain": [
                [1, 1, "JUPITER", 2460100.4829606046, 2467040.2329606046],
                [2, 0, "JUPITER", 2460100.4829606046, 2461321.364905049],
                [3, 7, "SATURN", 2461208.3202805636, 2461321.364905049],
                [4, 5, "MOON", 2461279.49652561, 2461295.1971679]
              ]
            }
          ]
        }
      }
    },
    "yogini": {
      "total_years": 36,
      "sequence": [
        {
          "lord": "MOON",
          "years": 1,
          "yogini": "Mangala"
        },
        {
          "lord": "SUN",
          "years": 2,
          "yogini": "Pingala"
        },
        {
          "lord": "JUPITER",
          "years": 3,
          "yogini": "Dhanya"
        },
        {
          "lord": "MARS",
          "years": 4,
          "yogini": "Bhramari"
        },
        {
          "lord": "MERCURY",
          "years": 5,
          "yogini": "Bhadrika"
        },
        {
          "lord": "SATURN",
          "years": 6,
          "yogini": "Ulka"
        },
        {
          "lord": "VENUS",
          "years": 7,
          "yogini": "Siddha"
        },
        {
          "lord": "RAHU",
          "years": 8,
          "yogini": "Sankata"
        }
      ],
      "reference_nakshatra": 0,
      "count": "from_reference",
      "span": 1,
      "offset": 3,
      "methods": {
        "spatial": {
          "first_lord": "VENUS",
          "balance": {
            "years": 6,
            "months": 7,
            "days": 4,
            "hours": 21,
            "minutes": 29,
            "total_days": 2409.457380463339
          },
          "tree_depth": 2,
          "row_format": ["path", "lord", "start_jd", "end_jd"],
          "periods": [
            ["0", "VENUS", 2458953.122303241, 2461362.5796837043],
            ["0/0", "VENUS", 2458953.122303241, 2459421.6279049977],
            ["0/1", "RAHU", 2459421.6279049977, 2459957.062878434],
            ["0/2", "MOON", 2459957.062878434, 2460023.9922501137],
            ["0/3", "SUN", 2460023.9922501137, 2460157.8509934726],
            ["0/4", "JUPITER", 2460157.8509934726, 2460358.639108511],
            ["0/5", "MARS", 2460358.639108511, 2460626.3565952294],
            ["0/6", "MERCURY", 2460626.3565952294, 2460961.003453627],
            ["0/7", "SATURN", 2460961.003453627, 2461362.5796837043],
            ["1", "RAHU", 2461362.5796837043, 2464284.5796837043],
            ["1/0", "RAHU", 2461362.5796837043, 2462011.913017038],
            ["1/1", "MOON", 2462011.913017038, 2462093.0796837043],
            ["1/2", "SUN", 2462093.0796837043, 2462255.413017038],
            ["1/3", "JUPITER", 2462255.413017038, 2462498.913017038],
            ["1/4", "MARS", 2462498.913017038, 2462823.5796837043],